{
  "activity_profile": "storyos.project-activity.v1",
  "api_major": 1,
  "compatibility_profile": "storyos.public.same-release.v1",
  "contract_revision": "release1-wire-catalog-2026-09-27-expiry-rebuild",
  "envelope_version": 1,
  "limit_profile_revision": "storyos.foundation.absolute.v1",
  "max_json_string_utf8_bytes": 1048576,
  "problem_profile": "storyos.problem.v1",
  "public_protocol_release": "storyos.public.release.1",
  "release_identity": {
    "activity_profile": "storyos.project-activity.v1",
    "api_major": 1,
    "contract_graph_digest": "sha256:977c148ced4b8b2f774795aa3c577fa3e2e0b3b23b560fb62c8113cd907539a2",
    "contract_graph_revision": "release1-wire-catalog-2026-09-27-expiry-rebuild",
    "envelope_profile": "storyos.public.envelope.v1",
    "fixture_corpus_digest": "sha256:4d7cfe2f010f3aa8039501051692bb8cdf2ed39d4704352cd47b100504bfa7a5",
    "generated_client_revision": "storyos.typescript-client.release-1.v32",
    "json_schema_catalog_digest": "sha256:d590c29513b831583c7df5c600701e9210b54053c961b082cf2c2001b8f91e61",
    "limit_profile_revision": "storyos.foundation.absolute.v1",
    "openapi_digest": "sha256:f8e178e39c9a16fd950883f402ef83a270d9c3062df629e265ba44858ed39380",
    "public_protocol_release": "storyos.public.release.1",
    "schema_id": "storyos.compatibility.release-identity.v1",
    "server_contract_revision": "storyos.server.release-1.v7",
    "typescript_artifact_digest": "sha256:3e173309fd714e6b655e8673f1b57f5ae6c91ade3e8a7b2dcd2944a4aed22b0d",
    "web_client_contract_revision": "storyos.web-client.release-1.v3",
    "worker_contract_revision": "storyos.worker.release-1.v6"
  },
  "required_capabilities": [
    "project_lifecycle",
    "volume_chapter_lifecycle",
    "chapter_navigation",
    "manuscript_search",
    "direct_author_edit",
    "single_match_replace",
    "multi_match_cross_location_proposal",
    "manuscript_statistics",
    "human_readable_manuscript_export",
    "portable_project_archive",
    "editor_session_takeover",
    "snapshot_resync",
    "proposal_draft_lifecycle",
    "project_activity",
    "acknowledgement_loss_outcome_query"
  ],
  "schema_id": "storyos.query.protocol-profile.response.v1"
}
