{
  "activity_profile": "storyos.project-activity.v1",
  "api_major": 1,
  "compatibility_profile": "storyos.public.same-release.v1",
  "contract_revision": "release1-wire-catalog-2026-09-27-expiry-rebuild",
  "envelope_version": 1,
  "limit_profile_revision": "storyos.foundation.absolute.v1",
  "max_json_string_utf8_bytes": 1048576,
  "problem_profile": "storyos.problem.v1",
  "public_protocol_release": "storyos.public.release.1",
  "release_identity": {
    "activity_profile": "storyos.project-activity.v1",
    "api_major": 1,
    "contract_graph_digest": "sha256:9c81f14531eda496421398fa8f6ee7819f4eeae637158182fac4808b1be5d8f9",
    "contract_graph_revision": "release1-wire-catalog-2026-09-27-expiry-rebuild",
    "envelope_profile": "storyos.public.envelope.v1",
    "fixture_corpus_digest": "sha256:1f69e216c93b0589345135583f2844ef4b28872347a2009b388ffbd992c976b3",
    "generated_client_revision": "storyos.typescript-client.release-0.v1",
    "json_schema_catalog_digest": "sha256:94ce0d0d994940ce9474a19341854ccc03e75f91665cea72f110015949bd9489",
    "limit_profile_revision": "storyos.foundation.absolute.v1",
    "openapi_digest": "sha256:c95fce8be03830e7a4de5d80a6606867609bc6fc47dcf7dd0bac6049cfc9050d",
    "public_protocol_release": "storyos.public.release.1",
    "schema_id": "storyos.compatibility.release-identity.v1",
    "server_contract_revision": "storyos.server.release-1.v7",
    "typescript_artifact_digest": "sha256:ff966b03e5ba3644527cbc6c14364881897a5fd296ed488c763bf5c593ed68a9",
    "web_client_contract_revision": "storyos.web-client.release-1.v3",
    "worker_contract_revision": "storyos.worker.release-1.v6"
  },
  "required_capabilities": [
    "project_lifecycle",
    "volume_chapter_lifecycle",
    "chapter_navigation",
    "manuscript_search",
    "direct_author_edit",
    "single_match_replace",
    "multi_match_cross_location_proposal",
    "manuscript_statistics",
    "human_readable_manuscript_export",
    "portable_project_archive",
    "editor_session_takeover",
    "snapshot_resync",
    "proposal_draft_lifecycle",
    "project_activity",
    "acknowledgement_loss_outcome_query"
  ],
  "schema_id": "storyos.query.protocol-profile.response.v1"
}
